name,title,url_link,online
MBCNEWS,"""브라질 잡자"" 선수들 자신감 충전..역대전적 열세에 ""축구는 모른다"" [카타르NOW] (mbc뉴스 2022년 12월4일)",https://www.youtube.com//watch?v=5zDYOLJ4MkY,실시간
MBCNEWS,"피파랭킹 1위, 선수 몸값만 1.5조..국대 16강전 상대 브라질 전력은? [카타르NOW] (MBC뉴스 2022년 12월 4일)",https://www.youtube.com//watch?v=SGCNj_eyHQM,실시간
TIMES NOW,Russia Ukraine War Live: Satelite Images Show Moscow’s Massive Military Base In Occupied Mariupol,https://www.youtube.com//watch?v=G-yGxghdjzs,
LiveNOW from FOX,"Top stories, breaking news | LiveNOW from FOX",https://www.youtube.com//watch?v=y6FHIF_gZ48,
PokerStars,🔴  WEEKEND POKER MARATHON: The BEST POKER of ALL TIME! ♠️ PokerStars,https://www.youtube.com//watch?v=WRttGjEFQ6k,
NTV Kenya,NTV Kenya Livestream | November 2022,https://www.youtube.com//watch?v=MuyJqt6_2Jw,실시간
CNN-News18,Russian President Vladimir Putin Is Open To Talks And Diplomacy On Ukraine | Russia Vs Ukraine War,https://www.youtube.com//watch?v=Jd2kjgojIZ8,
Rainbow Six Esports,European Challenger League 2022 - Playday #7,https://www.youtube.com//watch?v=bTHVpCDL1Os,실시간
ABP NEWS,LIVE: कसाई ब्वॉयफ्रेंड के 'ड्रामा डोज' से पुलिस परेशान । Shraddha Murder Case । Delhi,https://www.youtube.com//watch?v=Mdgi4YNiKg0,
CNN-News18,Zelensky Says Cap On Russian Oil Insufficient | Russia Vs Ukraine War Update | English News Live,https://www.youtube.com//watch?v=iZVw5jy8M90,
TV9 Telugu Live,CM KCR Speech LIVE | TRS Mahabubnagar Public Meeting - TV9,https://www.youtube.com//watch?v=K1zA55UWj3w,
Elevation Church,Join us now for a new message from Pastor Steven Furtick! [2:00PM ET Service],https://www.youtube.com//watch?v=GJJYJwHhkYQ,
몽키비지엠 MONKEYBGM,☃️ 아름다운 오스트리아에 재즈가 내려요💛 l 𝐖𝐈𝐍𝐓𝐄𝐑 𝐉𝐀𝐙𝐙 l Relaxing Jazz Piano Music for Good Mood💓,https://www.youtube.com//watch?v=tK-ZIEQEXMY,
NTV Telugu,🔴CM KCR Speech at Mahabubnagar Public Meet Live | TRS Public Meet at Mahbubnagar | cmkcrlive | Ntv,https://www.youtube.com//watch?v=cjeETKGIT58,
USGS,"Mauna Loa Eruption, HI - USGS live stream",https://www.youtube.com//watch?v=SnjGqn1K9ZQ,
My Little Pony Official,🔴 My Little Pony: Friendship Is Magic ❄️ Celebrating Holidays,https://www.youtube.com//watch?v=cqmTmI40iJQ,
News24,Ravish Kumar News 24 पर Exclusive | 'TV मत देखिए..मैं बाज़ारू पत्रकार नहीं'। Ravish Kumar Interview,https://www.youtube.com//watch?v=onpZCm7iSAU,
Mark Goldbridge That's Football,ENGLAND vs SENEGAL LIVE Stream Watchalong | QATAR 2022,https://www.youtube.com//watch?v=xtPNemc5QgQ,실시간
SMITE by Titan Forge Games,SMITE PRO LEAGUE: PHASE 3 PLAYOFFS - DAY FOUR,https://www.youtube.com//watch?v=38DOeh8xoo4,
Videogyan Nursery Rhymes - Kids Songs & Cartoons,Play Safe Song & More | Cartoons For Kids | Nursery Rhymes & Funny Playtime Stories| Learning Songs,https://www.youtube.com//watch?v=Cabrslomhlw,실시간
The Relaxed Guy,"🔴 Super Heavy Rain Storm all Night Long to Sleep Instantly & Beat Insomnia, Study or Relax",https://www.youtube.com//watch?v=vDG0LTAnH6k,
맛있는 녀석들 (Tasty Guys),하늘은 높고 살은 내가 찌는 ★천고마뚱★ 사골 스트리밍 랜덤 라이브,https://www.youtube.com//watch?v=AvrP5xodcLU,
Browns Report by Chat Sports,"Browns vs. Texans LIVE Streaming Scoreboard, Deshaun Watson’s Debut & Highlights | NFL Week 13",https://www.youtube.com//watch?v=LdjVx5gSpRE,실시간
Jaiden Animations,SUBATHON DAY 18- Completing the PokeDex (Undertale later!),https://www.youtube.com//watch?v=KAq4q-y-zJs,
Deep Light,"Kygo, Avicii, Ed Sheeran, Dua Lipa, Coldplay, Martin Garrix, The Chainsmokers Style - Feeling Me",https://www.youtube.com//watch?v=FmMqBp2icmw,
AVP Beach Volleyball,AVP Central Florida 2022 | Dalhausser/Crabb vs. Hyden/Bourne | Sunday | Stadium Court,https://www.youtube.com//watch?v=ARWiafGFbXM,실시간
Tom Grossi,Packers vs Bears Live Play by Play & Reaction,https://www.youtube.com//watch?v=grvWYDDh7o4,
Expressions Oozing,England vs Senegal|  WORLD CUP 2022 LIVE Watch Along with EXPRESSIONS and @RantsNBants,https://www.youtube.com//watch?v=cU13RBVhe7w,
Bethel,Join us LIVE | Bethel Church,https://www.youtube.com//watch?v=kgOsKn5BGDI,실시간
STUDYCODE,Study with me 🔥 스터디윗미 | with 스터디코드 조남호 | 스터디윗코드 | LIVE,https://www.youtube.com//watch?v=OKsef80XyDI,실시간
VexTrex,The Floor is Lava #5. Hot Job | Lion Family | Cartoon for Kids,https://www.youtube.com//watch?v=8eOCvLax4qs,
Tigger ASMR,"🌙 꿈꾸는 여행자들의 밤 Sleep Music, Fantasy, ASMR, Ambience, 8hr, Meditation, Relaxing, 수면 음악, 불면증, 중세 판타지 여관",https://www.youtube.com//watch?v=qHuLqHYHW6c,
Cozy Smooth Jazz,A Christmas Ambience by A Cozy Fireplace 🎄 Sweet Instrumental Christmas Jazz Music & Fireplace Sound,https://www.youtube.com//watch?v=1gtLeZzl9cs,실시간
Old Song Music,[ 광고 없음 ] 상처받은 이들에게💕추억의 힐링올드팝송모음💕 Greatest Oldies songs,https://www.youtube.com//watch?v=qjAGk2d8GQo,실시간
Therm,Let's play Bugsnax LIVE (ep 1),https://www.youtube.com//watch?v=VPZWJrLaRL8,
VERDOLAGA TV,🔴 Inglaterra vs Senegal EN VIVO Mundial Qatar 2022,https://www.youtube.com//watch?v=vWYQTilioOE,실시간
Saint Lucia Government,"2022 Graduation Ceremony of The Sir Arthur Lewis Community College (December 4, 2022)",https://www.youtube.com//watch?v=MgJsbaRwPDY,실시간
TUN TUN,ASMR RAINBOW DESSERTS 무지개 디저트 코하쿠토 닉클립 MUKBANG Galaxy Honey Jelly || Coffin Dance Remix (Cover),https://www.youtube.com//watch?v=SkUcRjg4Lq4,
Animal Stop Motion Cooking,Stop motion ASMR - Catfish hunting Colorful carp koi fish - 다채로운 잉어물고기 | 거대한 개구리 - 무지개 메기/ 스톱 모션,https://www.youtube.com//watch?v=O4K7Zv5YPhw,
123 GO! SCHOOL,EASY & CHEAP IDEAS FOR SCHOOL || Take Care Of Your Money! Funny Situations by 123GO! SCHOOL,https://www.youtube.com//watch?v=oZfn_f9U6ZA,
Sikhism Tv,LIVE | Kirtan Darbar Sahib Amritsar | SGPC | 04 DEC 2022  | Sikhism Tv,https://www.youtube.com//watch?v=bL_HZa8Y6Yw,
123 GO! SCHOOL,COOL PARENTING HACKS || RICH VS POOR! Survival Guide For Students! Funny Ideas by 123GO! SCHOOL,https://www.youtube.com//watch?v=H6AyRPueF74,
123 GO! FOOD,SMART PARENTING HACKS & TRICKS || Good VS Bad Parents! Best Snack Situations by 123 GO! FOOD,https://www.youtube.com//watch?v=KBveyiC83sU,
Pea Pea World,Pea Pea와 자이언트 프링글스 감자 칩 챌린지 - 재미있는 스톱 모션 만화,https://www.youtube.com//watch?v=jLmJ4716PwM,실시간
서은일상이야기,아이스크림 젤리 초콜릿 캔디  Fruits Ice Cream Jelly Chocolate Candy,https://www.youtube.com//watch?v=IN1dQUeFZyA,실시간
No Somos TV,PALABRA DE HINCHA - INGLATERRA VS SENEGAL,https://www.youtube.com//watch?v=wUt9omJS8nk,
서은일상이야기,프링글스 자판기 아이스크림 초콜릿 디저트 Pringles Chocolate Ice Cream Candy Dessert Mukbang,https://www.youtube.com//watch?v=L95sodIaJxo,실시간
RATATA COOL!,Eating Only PINK Color Food Challenge! | BUYING Everything in ONE COLOR 24 HOURS by RATATA COOL,https://www.youtube.com//watch?v=zAypMgssmW8,실시간
Tesla US,"🚨 Elon Musk: What Is The Future Of Ethereum and Bitcoin?! BTC Pump To $90,000 Soon!? Tesla SEMI",https://www.youtube.com//watch?v=FH4iAx-Py3I,실시간
Soft Rock,"Phil Collins, Eric Clapton, Michael Bolton, Bee Gees, Rod Stewart- Soft Rock Hits 80s 90s Full Album",https://www.youtube.com//watch?v=YICd6qwkeY0,실시간
Nucleya Gaming,CHARLES LUCIANO / HITTING BANK TODAY / NEW GANG OR CIVILLIAN  - NUCLEYA,https://www.youtube.com//watch?v=_3H6GuGLZAY,
Pea Pea,Why Pea Pea Locked Up? - Stop Motion Cartoon,https://www.youtube.com//watch?v=I3fxRK_9zXc,
Yum Yum,ASMR MUKBANG | 직접 만든 갤럭시 꿀젤리 블루 디저트 아이스크림 먹방 & 레시피 DESSERT Galaxy Honey Jelly Color CANDY mukbang,https://www.youtube.com//watch?v=Z7rdcdHzvzk,실시간
PrizeSleep-Sleeping Music For Deep Sleeping,"Relaxing Sleep Music 24/7, Healing Music, Meditation Music, Spa Music, Sleep Music, Study Music",https://www.youtube.com//watch?v=_lKdyq0l9E4,실시간
Pico Pocky,ASMR MUKBANG | 직접 만든 갤럭시 꿀젤리 블루 디저트 아이스크림 먹방 & 레시피 DESSERT Galaxy Honey Jelly Color CANDY mukbang,https://www.youtube.com//watch?v=-Id0Y9HIBkA,
Pico Pocky,ASMR RAINBOW DESSERTS 무지개 디저트 코하쿠토 닉클립 MUKBANG Galaxy Honey Jelly,https://www.youtube.com//watch?v=4OBvhP2AxXE,
Challenge Accepted,My new Boyfriend is a VAMPIRE - Weirdos and Vampire Love Story by Challenge Accepted,https://www.youtube.com//watch?v=Heh6KRDd4-E,실시간
hughwizzy,ENGLAND v SENEGAL | WORLD CUP WATCHALONG | #Qatar2022,https://www.youtube.com//watch?v=WyxlaUBNigI,
Pea Pea Korea,뜨겁고 차가운 도전 컬렉션이 포함된 Pea Pea - 재미있는 스톱 모션 애니메이션,https://www.youtube.com//watch?v=llPT73zAG2I,실시간
Pea Pea Korea,100개의 미스터리 버튼이 있는 Pea Pea 챌린지 - 재미있는 스톱 모션 만화,https://www.youtube.com//watch?v=XBkuU8cX8VU,실시간
