name,title,url_link,online
맛있는 녀석들 (Tasty Guys),하늘은 높고 살은 내가 찌는 ★천고마뚱★ 사골 스트리밍 랜덤 라이브,https://www.youtube.com//watch?v=AvrP5xodcLU,
VikiNiki,Black Food vs Blue Food Challenge  디저트 챌린지,https://www.youtube.com//watch?v=WZK6uxtfHoI,실시간
NIC Webcast,Supreme Court of India - Court 3,https://www.youtube.com//watch?v=8zsxbTyIRYg,실시간
MBN News,[MBN LIVE/프레스룸] [프레스룸에 온다] 용혜인 의원 출연 - 2022.12.07 (수),https://www.youtube.com//watch?v=GGTwDMnVqQM,실시간
موقع الشيخ عبد الباسط عبد الصمد,🛑 قرآن الصباح - تلاوة جميلة جداً بصوت الشيخ عبدالباسط عبدالصمد  ♥️ | Abdulbasit Sheikh Abdulbasit,https://www.youtube.com//watch?v=0WQoMWvnGSc,실시간
사자후TV,더 탐사 압수수색,https://www.youtube.com//watch?v=TdiJqN2sCvs,실시간
أنا مسلم - I'm a Muslim,قرآن الصباح | سورة البقرة لحفظ وتحصين المنزل وجلب البركة | من أروع ما جود الشيخ عبدالباسط عبدالصمد,https://www.youtube.com//watch?v=GxJB6VAxO60,
Hindi hits LOve,Best Of Emraan Hashmi top 10 songs,https://www.youtube.com//watch?v=lYPVyPjLcUs,실시간
SBS 뉴스,[LIVE] '16강' 대표팀 어디까지 왔니?..'귀국' 태극전사 함께 맞으실 분? / 12년 만의 16강 달성한 축구 국가대표팀 / SBS,https://www.youtube.com//watch?v=EAlUQEJpaUY,
몽키비지엠 MONKEYBGM,"🥂고급진 분위기에 어울리는 재즈플레이리스트💕 l 𝐋𝐎𝐔𝐍𝐆𝐄 𝐉𝐀𝐙𝐙 l Positive Jazz Piano Music for Restaurant, Cafe, Store",https://www.youtube.com//watch?v=U0LBYYFkZUI,
KBS 1라디오,[KBS1 라디오] 실시간 스트리밍,https://www.youtube.com//watch?v=m18vC5JtecY,실시간
Sports Updates By Chandan 1,India vs Bangladesh 2nd ODI Live | IND vs BAN 2nd ODI Live Scores & Commentary | Only in India,https://www.youtube.com//watch?v=7GwYNDQq5BY,
BOL News,BOL vs Imported Government | Haqeeqi Sahafat Kay Liye BOL | Breaking News,https://www.youtube.com//watch?v=ND5SLdff6gs,
Zee Business,RBI Monetary Policy LIVE | Zee Business LIVE | RBI Policy | Shaktikanta Das | RBI Rate Hike,https://www.youtube.com//watch?v=Z8s0yYrsx7k,
T News Telugu,LIVE: Varthalu Vasthavalu | KCR Jagtial Tour | Modi all-party Meet |Parliament Winter Session |TNews,https://www.youtube.com//watch?v=Qet3PqMpC1o,
ИНФОРМАТОР,ASMR MUKBANG | 직접 만든 갤럭시 꿀젤리 블루 디저트 아이스크림 먹방 & 레시피 DESSERT Galaxy Honey Jelly CANDY asmr #64,https://www.youtube.com//watch?v=wOcCtIaKXOI,
MBCNEWS,[Live] MBC 뉴스 나우 - 2022년 12월 7일,https://www.youtube.com//watch?v=MIwLl6aPQL8,실시간
ИНФОРМАТОР,ASMR MUKBANG | 직접 만든 갤럭시 꿀젤리 블루 디저트 아이스크림 먹방 & 레시피 DESSERT Galaxy Honey Jelly CANDY asmr #74,https://www.youtube.com//watch?v=NuctQbzCEm4,
Republic World,AAP vs BJP LIVE | Delhi MCD Election Results | Arnab Goswami on Republic,https://www.youtube.com//watch?v=4K-zE35M9jU,
MBCNEWS,‘꺾이지 않는’ 대한민국..축구대표팀 입국 현장- [끝까지LIVE] MBC뉴스 2022년 12월 7일,https://www.youtube.com//watch?v=2svHeTRyAGA,실시간
MBCNEWS,28골 쏟아졌다..16강 경기 H/L[카타르NOW] (mbc뉴스 2022. 12. 07),https://www.youtube.com//watch?v=y7l93zCSLwY,실시간
TIMES NOW,Ukraine War Live : Zelenskyy Visits Troops Near Front Line After Putin Drives Across Crimea Bridge,https://www.youtube.com//watch?v=O_b9eVFAAoA,
Jaiden Animations,JAIDEN'S CHAT PLAYS POKEMON! r/jaidentpp,https://www.youtube.com//watch?v=94wp0NywUqg,
Chill Music Lab,집중력과 창의성을 위한 Chill Music Radio - 딥 컨센트레이션 믹스,https://www.youtube.com//watch?v=4S6sG38zmTA,
KBS News,"[🔴모아보기] '화물연대 지원' 민주노총 총파업… 이상민 행안부 장관 ""끝까지 책임 묻겠다""/2022년 12월 7일(수)/KBS",https://www.youtube.com//watch?v=hLKvgdNXTC4,실시간
YTN 사이언스,[건강정보-LIVE] 합병증이 더 무서운 고혈압. 진단과 예방법 (김근호 교수_한양대학교병원),https://www.youtube.com//watch?v=6sgcoR_f9UY,
Dr. SaxLove,Tuesday Jazz ❤️ Smooth Jazz Music for Peace and Relaxation,https://www.youtube.com//watch?v=cL-vUY5oK7Q,
5-Minute Crafts,CHRISTMAS LIVE ❄️ Easy Xmas Decor And Snacks,https://www.youtube.com//watch?v=zgOdzcM-bbA,
The Relaxed Guy,"🔴 Heavy Rain No Thunder, Fall Asleep in 2 Minutes, Heavy Rainfall on Road. Tinnitus Relief",https://www.youtube.com//watch?v=kXOXjc8v_8o,
Zee News,Delhi MCD Result Live: दिल्ली MCD के नतीजे सबसे पहले LIVE | Arvind Kejriwal | BJP Vs AAP | Live News,https://www.youtube.com//watch?v=kBkq_8ugZHM,
India Today,Rajya Sabha LIVE | Parliament Winter Session 2022 | Parliament Livestream | Winter Session LIVE,https://www.youtube.com//watch?v=Dg1HhIvuS80,
Sakshi TV,LIVE: Jayaho BC Mahasabha Live | CM Jagan | YSRCP Public Meeting | Vijayawada | Sakshi TV,https://www.youtube.com//watch?v=n18GnEUwgvs,
Soft Rock,"Michael Bolton, Phil Colins, Lionel Richie, Bread, Air Supply, Rod Stewart -Best Soft Rock Nonstop",https://www.youtube.com//watch?v=gdOL3i8It-c,실시간
Music Library,"Billboard hot 100 This Week 🎵 Maroon 5, Adele,  Bilie Eilish, Taylor Swift, Sam Smith, Dua Lipa",https://www.youtube.com//watch?v=gVKg_xFDKDE,실시간
India Today,Supreme Court Livestream | Modi Govt's Demonetisation Policy Under Challenge | SC Constitution Bench,https://www.youtube.com//watch?v=m4nRJao1ONs,
Republic Bharat,MCD Election Result LIVE: अबकी बार MCD में किसकी सरकार ? | AAP | BJP | Arvind Kejriwal | R Bharat,https://www.youtube.com//watch?v=Gv1AcCrCHXg,
The Relaxed Guy,"🔴 Thunder and Rain All Night on Road to Sleep in 2 Minutes & Stop Insomnia, Study, Relax",https://www.youtube.com//watch?v=RE7354vEwy8,
BRIGHT SIDE,What If Kraken and Cthulhu Had to Share the Ocean,https://www.youtube.com//watch?v=nUDhiUTUBsQ,
Sakshi TV,LIVE: Jayaho BC Mahasabha | CM Jagan | Vijayawada | Sakshi TV,https://www.youtube.com//watch?v=jagdciPd20I,
Holly Jolly Christmas,Top 100 Christmas Songs of All Time 🎄 Best Christmas Songs 🌲 Christmas Songs Playlist 2023,https://www.youtube.com//watch?v=GLBfWWd3how,실시간
4K Video Nature - Focus Music,Deep Focus Music To Improve Concentration - 12 Hours of Ambient Study Music to Concentrate #371,https://www.youtube.com//watch?v=IBa9oFoQRTo,
The Independent,Live: Skyline view of Doha during the Qatar World Cup,https://www.youtube.com//watch?v=fjnItTt4qqk,
몽키비지엠 MONKEYBGM,"🎹적당히 포근한 방구석 재즈🧡l 𝐇𝐞𝐚𝐥𝐢𝐧𝐠  𝐉𝐚𝐳𝐳 l Relaxing Jazz Piano Music,Calm, Meditation, Stress relief",https://www.youtube.com//watch?v=tikMYX5v5zI,
TV9 Bharatvarsh,"TV9 Bharatvarsh LIVE। AAP का धमाल, दिल्ली के बाद अब MCD में भी सरकार! MCD Election Results",https://www.youtube.com//watch?v=EHnsmV54kZ4,
Teen-Z,LEARN ALPHABER LORE WITH TEEN-Z  || Awesome SCHOOL Pranks and Funny Situations,https://www.youtube.com//watch?v=jdxK22zyyg0,
Pete Bellis & Tommy,Deep House 2022 I Chill Out Mega Hits,https://www.youtube.com//watch?v=a3htIwOg4o0,실시간
OTV,LIVE l ଦିଲ୍ଲୀ ମହାନଗର କାହାର ? l Delhi MCD Election Results l OTV,https://www.youtube.com//watch?v=Ctcm3VxSMvY,
몽키비지엠 MONKEYBGM,☃️ 아름다운 오스트리아에 재즈가 내려요💛 l 𝐖𝐈𝐍𝐓𝐄𝐑 𝐉𝐀𝐙𝐙 l Relaxing Jazz Piano Music for Good Mood💓,https://www.youtube.com//watch?v=DmcdhsaE6RM,
No Jumper,Listening To Your Music w/the No Jumper Crew,https://www.youtube.com//watch?v=I-ywrj2oaz8,
Gentle Melody,Relaxing Christmas Music 2023 ❄️ Top Christmas Hits 2023 🎁 Songs that make u feel Christmas closer,https://www.youtube.com//watch?v=stTQQAVIcD8,
Donganh Monkey,1001+ Best Of Miniature Chocolate Cake Decorating Ideas - Rainbow Ice Cream by Baby Monkey,https://www.youtube.com//watch?v=u07QBCHUdUQ,
ИНФОРМАТОР,ASMR MUKBANG | 직접 만든 갤럭시 꿀젤리 블루 디저트 아이스크림 먹방 & 레시피 DESSERT Galaxy Honey Jelly CANDY asmr #7,https://www.youtube.com//watch?v=UsIsfu4CG4M,
Republic World,Who Will Rule Delhi's Civic Body? MCD Results LIVE on Republic TV | Delhi MCD Election Result,https://www.youtube.com//watch?v=cKBdqo8f3OI,
11Alive,Georgia Senate race | Incumbent Raphael Warnock projected winner,https://www.youtube.com//watch?v=rodZy0FcmgM,
ИНФОРМАТОР,ASMR MUKBANG | 직접 만든 갤럭시 꿀젤리 블루 디저트 아이스크림 먹방 & 레시피 DESSERT Galaxy Honey Jelly CANDY asmr #2724,https://www.youtube.com//watch?v=ajJzZiz3Au4,
ROBOT CHALLENGE,ASMR JELLY CANDY PINK BLUE PARTY 다양한 블루 핑크 아이스크림 젤리 DESSERTS ICE CREAM MUKBANG EATING SOUNDS HUBABOY,https://www.youtube.com//watch?v=XsFGNd48upk,실시간
K-POP 발라드 모음,일할 때 듣기 좋은 노래 💖 1990년대 ~ 2000년대 감성 발라드 모음💖 하루 종일 듣기 좋은 베스트 50곡 - 비오는날 듣기 좋은 발라드곡 모음,https://www.youtube.com//watch?v=wvokSla-H7I,
Peppa Pig - Official Channel,🔴 LIVE Peppa Pig's Clubhouse 🐷🏠 BRAND NEW SEASON 9 PEPPA,https://www.youtube.com//watch?v=2_RUZRYIMN8,
Relaxing Whiskey Blues,Relaxing Whiskey Blues - A Little Whiskey And Midnight Blues - Moody Blues Songs For You | RWB3354,https://www.youtube.com//watch?v=gabLBR6hjFI,
123 GO! SCHOOL,COOL & CHEAP IDEAS FOR SCHOOL || Take Care Of Your Money! Funny Situations by 123GO! SCHOOL,https://www.youtube.com//watch?v=VH_RFqt-Lss,
