name,title,url_link,online
Pea Pea World,Pea Pea와 자이언트 프링글스 감자 칩 챌린지 - 재미있는 스톱 모션 만화,https://www.youtube.com//watch?v=jLmJ4716PwM,실시간
VikiNiki,ASMR JELLY CANDY 여러가지 젤리 먹방 MUKBANG,https://www.youtube.com//watch?v=hrl6vbq4Wuw,실시간
사랑의교회,주후 2022년 12월 4일  주일예배,https://www.youtube.com//watch?v=BYmtKTkcSWE,
스픽스,"📍[스픽스 HOT] 왁자지껄_윤통 200일, 열통 쌓이는 민심/노영희,윤석열 절대 안 변한다/나들이쇼_강신업, 당권도전 사전 교감설/김성회,지독하게 편협한 윤석열 인간관계",https://www.youtube.com//watch?v=i1p_0Gr43sQ,실시간
THE CROSS CHURCH,[하나님의 의도 (행 13:21-23)] 박호종 목사 2022.12.4 주일설교,https://www.youtube.com//watch?v=GJ7ufxwjCeA,실시간
우리들교회,우리들교회 주일예배 생방송 (12/04),https://www.youtube.com//watch?v=fJACDDxffXI,실시간
Ludwig,"HUGE YUGIOH TOURNEY FT. @penguinz0, @fuslie, @Sykkuno, @LilyPichu, @Blau, @DisguisedToast, @Th3Vale",https://www.youtube.com//watch?v=mi9nYzyXpgA,
몽키비지엠 MONKEYBGM,"🥤Cafe & Relaxing Jazz Piano Background Music for study, work, focus l 카페재즈, 매장음악, 라운지재즈",https://www.youtube.com//watch?v=WH7dreuzQLY,
인천순복음교회,인천순복음교회 주일예배,https://www.youtube.com//watch?v=J0mKROUoTmk,실시간
공부하는지호 Ziho,(22.12.04.일) Study with me/🔥모닥불 ASMR/실시간 공부 방송/ 스터디 윗미/ 교시제/ 수능/ 공시생/ 고시생/ 스윗미/ 라이브/ LIVE,https://www.youtube.com//watch?v=PW6CwG4PUbA,
죠니월드,로스트아크LIVE🍓 부캐들 돌봐주기. 영업대회 참가자 모집 중,https://www.youtube.com//watch?v=JOvkqa9T_8o,
김학중 목사_꿈의교회 미디어교회,주일예배 실시간 꿈의교회 l 김학중 목사 설교 온라인예배 실황 생방송 _ 2022년 12월 4일,https://www.youtube.com//watch?v=_XiW-7W__No,실시간
MBCNEWS,16강 대진표 확정..대한민국 경쟁팀 조별리그 3차전 H/L 몰아보기 [카타르NOW] (MBC뉴스 2022년12월3일),https://www.youtube.com//watch?v=_M1F9v5ANsc,실시간
KBS News,[⚽모아보기] 꿈★은 다시 이루어진다/외신도 극찬한 ‘손-황 듀오’…프리미어리거가 해냈다/2022년 12월 4일(일)/KBS,https://www.youtube.com//watch?v=F8mfjG-yuC4,실시간
Jaiden Animations,JAIDEN'S CHAT PLAYS POKEMON! r/jaidentpp,https://www.youtube.com//watch?v=l4wTi7RNVKw,
YTN 사이언스,"남성들 잘 걸리는 대장암, 원인과 조기진단법_박지원 교수(서울대학교병원 대장항문외과)",https://www.youtube.com//watch?v=rkrpvbckQwI,
My Little Pony Official,🔴 My Little Pony: Friendship Is Magic ❄️ Celebrating Holidays,https://www.youtube.com//watch?v=Dt3Cqiz6juA,
Tim Janis,"Christmas Instrumental  Music, Beautiful Christmas Music, ""A Christmas in New England"" by Tim Janis",https://www.youtube.com//watch?v=U3Eubz93Lbw,
Yellow Brick Cinema - Relaxing Music,"🔴 Relaxing Music 24/7, Healing Music, Meditation Music, Spa Music, Sleep, Zen, Flowing Stream",https://www.youtube.com//watch?v=1fBsi2n7zu4,
KBS 1라디오,[KBS 1라디오] 실시간 스트리밍,https://www.youtube.com//watch?v=BQa08T3lIOo,실시간
CNN-News18,Tik Tok Poses National Security Concerns: FBI Director | Trump News | US News Live | News18 Live,https://www.youtube.com//watch?v=KRCJ1fGYrM0,
Republic Bharat,LIVE TV: Delhi MCD चुनाव के लिए वोटिंग शुरू | Voting Day | MCD Election 2022 | Chunav Day | R Bharat,https://www.youtube.com//watch?v=QzClOyMXO9g,
Oh Santa,Merry Christmas 2022  🎷 Top Christmas Songs Playlist 2022 🤶️ Best Pop Christmas Songs Ever🤶️ 🎷,https://www.youtube.com//watch?v=UdG4tfms0P4,실시간
Republic World,Delhi MCD Elections | Big Political Faceoff | Elections 2022 | Gujarat Elections Phase 2 | LIVE,https://www.youtube.com//watch?v=Zvcp-Zgpk_0,
Radio Cassette,벽난로와 함께 휴식 크리스마스 캐롤 음악 🎄 악기 크리스마스 음악 ⛄ 크리스마스 분위기,https://www.youtube.com//watch?v=BfpzXl9LHyc,실시간
999 Animation,"Oh my! Help Rainbow Friends: Sad Story of Blue, Pink, Green, Purple, Red, Orange (Cartoon Animation)",https://www.youtube.com//watch?v=AT8y-q_1Icg,실시간
PokerGO,PokerGO NFT Invitational 2022 | Final Table,https://www.youtube.com//watch?v=6dECb3Co6zA,
TIMES NOW,Ukraine Russia War Live: Putin 'Humiliates' Biden As Moscow Rejects US Terms For Peace With Zelensky,https://www.youtube.com//watch?v=6SP1MJfZHoo,
WildEarth,WildEarth - Sunrise  Safari - 04 Dec 2022,https://www.youtube.com//watch?v=EI3kC28AJ2I,실시간
Coffee Relaxing Jazz,Instrumental Christmas Jazz Music🎄Cozy Christmas Ambience with Cracking Fireplace for Relaxing 🔥,https://www.youtube.com//watch?v=5F8aQ2ohsiY,실시간
African Music,"Afrobeats Mix 2022 - ASAKE, Tiwa Savage, Burna Boy, Rema, Wizkid, Ruger - Top Afrobeats Mix  2022",https://www.youtube.com//watch?v=rJZxOrQ3HZM,
ABP NEWS,Breaking News LIVE | Delhi MCD Election 2022 | Delhi MCD Election Voting LIVE Updates | MCD Election,https://www.youtube.com//watch?v=Frhzj3TDZCc,
MIRROR NOW,"US Defends Military Drills With India, Says It is None of China's Business | India-Us Joint Drills",https://www.youtube.com//watch?v=pIiqPCKuMzk,
NDTV,Delhi Municipal Election 2022: Voting For Delhi Municipal Corporation Today | NDTV 24x7 Live TV,https://www.youtube.com//watch?v=_q4iOpOWFos,
19.08 XMas,Merry Christmas 2023 🎅🏼 Best Non Stop Christmas Songs Medley 2023 🎄 Top Best Christmas Songs 2023,https://www.youtube.com//watch?v=MYn9tywBytw,실시간
FightinCowboy,🔴Live - The Callisto Protocol - Part 3,https://www.youtube.com//watch?v=JijLOxTu7So,
BOM BALLS,"DIY - How To Build House, Swimming Pool For Eel From Magnetic Balls (Satisfying) | Bom Balls",https://www.youtube.com//watch?v=eVIkJfbMVIM,
Jazz & Blues,Top 100 Whiskey Blues Songs 🍁 Relaxing Whiskey Blues Music 🍁 Greatest Slow Blues/ Rock Ballads Songs,https://www.youtube.com//watch?v=esRP15bJHoI,실시간
logo blocks,"FORTNITE FRACTURE EVENT GAMEMODE RELEASE COUNTDOWN LIVE🔴 24/7, How Long Till The Fracture Event?",https://www.youtube.com//watch?v=fkrMHneP0xw,
WEDARAK,[ 4K LIVE ] 임마누엘교회(서울) - 주일 2부 예배 2022.12.04,https://www.youtube.com//watch?v=Hdq-tyDi5Z8,실시간
K-POP 발라드 모음,"듣기만 해도 설레는 1990 년 발라드모음 우리가 사랑했던 추억노래💖우리가 잊고 있었던, 추억이 되어버린 20년 전 그 노래 들 💖가을에 듣기 좋은 노래 베스트",https://www.youtube.com//watch?v=eZ-xVlOSJhE,
WorldCam,🌎 Mauna Loa Volcano Eruption Hawaii | Recent Update from USGS!,https://www.youtube.com//watch?v=F8vT4J9wmRo,
Intrument Worship,Reflection of Praise Worship Songs Of All Time 🙏 Best Catholic Offertory Hymns ✝️JESUS - I NEED YOU,https://www.youtube.com//watch?v=6hg0MthsoNA,실시간
Hindi Romantic Songs,Non Stop Love Mashup 💚💛💚 Bollywood Songs Mashup 2022 | Romantic Mashup 2022,https://www.youtube.com//watch?v=kLrsjydLNR4,실시간
Peppa Pig - Official Channel,🔴 LIVE Peppa Pig's Clubhouse 🐷🏠 BRAND NEW SEASON 9 PEPPA,https://www.youtube.com//watch?v=zlSsMQpUpBA,
GhostNinja,Fortnite is BACK ONLINE! (Chapter 4),https://www.youtube.com//watch?v=hf0wEFwvFl4,
123 GO! SCHOOL,COOL PARENTING HACKS || RICH VS POOR! Survival Guide For Students! Funny Ideas by 123GO! SCHOOL,https://www.youtube.com//watch?v=Lw6auYRLr4c,
QuickGG,HARDEST NUZLOCKE EVER 1900+  ATTEMPTS.   POKEMON FIRERED (KAIZO IRONMON CHALLENGE),https://www.youtube.com//watch?v=k55q91ZqwMg,
Peppa Pig - Official Channel,🔴 Giant Peppa Pig and George Pig! LIVE FULL EPISODES 24 Hour Livestream!,https://www.youtube.com//watch?v=kmkxvwJzyqc,
Daily Recitation TV HD,Surah Yasin 🕌💚+ | Surah YASEEN (Ya-Seen) | سورة يس | Live,https://www.youtube.com//watch?v=5t45umNQbMI,
Avolo TV,"Big Balloons of Fanta & Pepsi, Giant Coca Cola, Schweppes, Sprite, Mirinda vs Hot and Cold VS Car #o",https://www.youtube.com//watch?v=X17bcd_9Up0,실시간
SM Story Animated,Princess Fashion Dress Design Result with Friends - Hilarious Cartoon Animation #p,https://www.youtube.com//watch?v=JCIFHaoLc1w,
123 GO! Genius,GENIUS PARENTING HACKS AND BEST MAKEUP TRICKS ||School Funny DIY Ideas and Tips By 123 GO! Genius,https://www.youtube.com//watch?v=sMOFOlf3HPc,실시간
게임하는인기,[로스트아크] 로아온 참가 계획 & 전카팩 102장 개봉,https://www.youtube.com//watch?v=KOYa2P05TEA,실시간
Animal Stop Motion Cooking,Stop motion ASMR | Crocodile catfish eel hunting colorful koi fish and rainbow carp 스톱 모션,https://www.youtube.com//watch?v=Y6NYkN-KEU8,
Animal Stop Motion Cooking,Stop motion ASMR - Catfish hunting Colorful carp koi fish  - 다채로운 잉어물고기 | 거대한 개구리 - 무지개 메기/ 스톱 모션,https://www.youtube.com//watch?v=lt1Kfu3GObg,
Vector Play,REALISTIC MINECRAFT IN REAL LIFE - THE MOVIE ( 2022 ),https://www.youtube.com//watch?v=4UKZBVHAZhA,
Two Pineapples,MAUNA LOA is ERUPTING | USGS Webcam Images | Big Island HAWAII,https://www.youtube.com//watch?v=C2_V6hfq_vE,실시간
Old Song Music,[ 광고 없음 ] 상처받은 이들에게💕추억의 힐링올드팝송모음💕 Greatest Oldies songs,https://www.youtube.com//watch?v=qjAGk2d8GQo,실시간
Gotcha!,AWESOME PARENTING HACKS FOR BEGINNERS ||  Amazing DIY Tips For Cool Parents by Gotcha!,https://www.youtube.com//watch?v=0KAND1cktPk,실시간
