name,title,url_link,online
맛있는 녀석들 (Tasty Guys),하늘은 높고 살은 내가 찌는 ★천고마뚱★ 사골 스트리밍 랜덤 라이브,https://www.youtube.com//watch?v=AvrP5xodcLU,
Animal Doodles,Stop motion ASMR - Catfish hunting Colorful carp koi fish - 다채로운 잉어물고기 | 거대한 개구리 - 무지개 메기/ 스톱 모션,https://www.youtube.com//watch?v=UO2kBs9XM_o,실시간
FOBOS PLANET,🔥 FIREPLACE (12 HOURS) Ultra HD 4K. Relaxing Fire Burning Video & Crackling Fireplace Sounds,https://www.youtube.com//watch?v=ZdMnVJdIu7o,
HOLY TUBE,[3일차] 정체성(창세기 32:24-30) - 데이비드 차 / 2022 라이트하우스 10차 기도회 LIVE(2022.12.05),https://www.youtube.com//watch?v=hmdOXR8UYtQ,실시간
주식단테_최고의 주식스승[ god of stock]📈,주식단테🔴다음주부터 쓸어담으면 3개월안에 급등할 종목!미리발굴 [2022년12월5일],https://www.youtube.com//watch?v=XDDG79Q3ncc,실시간
주식왕용느,주식왕용느★[인생찐찐찐막시즌]지옥으로 다시 돌아왔습니다 .,https://www.youtube.com//watch?v=VwdJomf7SSI,
KBS 1라디오,[KBS 1라디오] 정용실의 뉴스브런치,https://www.youtube.com//watch?v=BzIoNuBIz-w,실시간
MURDASHOW,SUNDAY GUNPLAY😈 MWII | WARZONE 2,https://www.youtube.com//watch?v=UGEUymeftmc,
몽키비지엠 MONKEYBGM,"🥂고급진 분위기에 어울리는 재즈플레이리스트💕 l 𝐋𝐎𝐔𝐍𝐆𝐄 𝐉𝐀𝐙𝐙 l Positive Jazz Piano Music for Restaurant, Cafe, Store",https://www.youtube.com//watch?v=D4h_DY9PxCo,
92 News HD,92 News HD Live Stream | Talk Shows | News Bulletins | Pakistan and worldwide News Updates 24/7,https://www.youtube.com//watch?v=FKkFUAG4rmI,
EKIPA UZIVO YouTube Live,ZADRUGA UZIVO 6 - IZBACIVANJE  05:00 05.12.2022 EKIPA UZIVO,https://www.youtube.com//watch?v=JRIXt3B851c,실시간
깔롱튜브[calong tube],목격자K 귀에서 피나는 고장난 라디오 스타 - 2 [live],https://www.youtube.com//watch?v=82wn9enhbY0,실시간
SBS 뉴스,"[LIVE] PLAY! 뉴스라이프, SBS 모바일24",https://www.youtube.com//watch?v=_7VUnv8842g,
한국경제TV,박한샘 | 소비재주들 반격의 이유와 순환매 #종목추천 #주식단타 #와우넷,https://www.youtube.com//watch?v=x1EaEm40ClY,
USGS,"Mauna Loa Eruption, HI - USGS live stream",https://www.youtube.com//watch?v=SnjGqn1K9ZQ,
Spiritual Mantra,LIVE: Shreeman Narayan Narayan Hari Hari - Dhun,https://www.youtube.com//watch?v=uyDOQwKiyjc,
행운명상음악 - Holistic Healing Music,"(주파수 업)🌞매일아침 들어라🌕상상도 못한 좋은일이 나에게 생긴다🌕하루종일 기분좋을일만 생긴다, 하루를 바꾸는 엔돌핀 음악, 주파수를 높이는 명상음악, 힐링 에너지음악",https://www.youtube.com//watch?v=UggnEHP4pqM,실시간
Pea Pea World,Pea Pea와 자이언트 프링글스 감자 칩 챌린지 - 재미있는 스톱 모션 만화,https://www.youtube.com//watch?v=jLmJ4716PwM,실시간
VikiNiki,ASMR ICE CREAM PINK BLUE PARTY 다양한 블루 핑크 아이스크림 젤리 먹방 DESSERTS JELLY,https://www.youtube.com//watch?v=xCTHZihONNE,실시간
Pico Pocky,ASMR MUKBANG | 직접 만든 갤럭시 꿀젤리 블루 디저트 아이스크림 먹방 & 레시피 DESSERT Galaxy Honey Jelly Color CANDY mukbang,https://www.youtube.com//watch?v=-Id0Y9HIBkA,
Little Baby Bum - Nursery Rhymes & Kids Songs,🔴 Baby Nursery Rhymes! LIVE! 🔴 Little Baby Bum Songs,https://www.youtube.com//watch?v=g3Ray6CtsK8,
Rock Music,"Top 100 Best Classic Rock Songs Of All Time Vol 107 🔥 Guns N Roses,Metallica,Queen,U2,CCR,Bon Jovi",https://www.youtube.com//watch?v=R3RX7QybW2M,실시간
Al Rojo Vivo,EN VIVO: Imágenes de la erupción del volcán Mauna Loa en Hawaii I Al Rojo Vivo,https://www.youtube.com//watch?v=8sQVW-zd6ZQ,
Magic Club,"Ibiza Summer Mix 2023 - Best Of Vocals Deep House, Nu disco Chill Out Mix - Remixes Popular Songs",https://www.youtube.com//watch?v=5Zx4QEychrM,
LiveNOW from FOX,"Top stories, breaking news | LiveNOW from FOX",https://www.youtube.com//watch?v=y6FHIF_gZ48,
Swagg,🔴 LIVE - FAZE SWAGG  PLAYS WARZONE 2 WITHOUT RAGING,https://www.youtube.com//watch?v=UqgREXUf_b0,
DUBYBUBA,Red VS Blue Food Dessert Mukbang 빨간색 파란색 디저트 먹방 DONA 도나,https://www.youtube.com//watch?v=-RENc-OBv1Y,실시간
Cafe Music BGM channel,🎄 Instrumental Christmas Jazz Music with Crackling Fireplace - Cozy Winter Christmas Ambience,https://www.youtube.com//watch?v=IwstMVCGVHo,
Music Brokers,Instrumental Covers Of Popular Songs / LoFi - Chill Hop,https://www.youtube.com//watch?v=5jNJ9W96sJM,
편안한 음악기도기도,Relaxing Christmas Carols 🎄 Traditional Instrumental Christmas Music  🎄 Christmas Songs,https://www.youtube.com//watch?v=cXxRXcmSTNo,
Funk & Soul,"Classic 70s 80s Disco Funk Soul - Cheryl Lynn, Michael Jackson,Rick James,Kool and The Gang and more",https://www.youtube.com//watch?v=2QI9cEwK614,실시간
Holly Jolly Christmas,Best Christmas Songs Of All Time 🔔 Merry Christmas 2023 🔔 Christmas Songs Playlist 2023,https://www.youtube.com//watch?v=tLxLVCuH0ls,실시간
Radio IFM,IFMTV 24/7,https://www.youtube.com//watch?v=-VcYM4r1NfY,
Samirumba,ASMR MUKBANG | 직접 만든 갤럭시 꿀젤리 블루 디저트 아이스크림 먹방 & 레시피 DESSERT Galaxy Honey Jelly CANDY asmr #285,https://www.youtube.com//watch?v=WGK4QXV7xeA,
Relax Music,Winter JAZZ - Snow Winter Music - Relaxing Winter Background Music,https://www.youtube.com//watch?v=EPr8vKnZF9U,
K-POP 발라드 모음,일할 때 듣기 좋은 노래 💖 1990년대 ~ 2000년대 감성 발라드 모음💖 하루 종일 듣기 좋은 베스트 40곡 - 비오는날 듣기 좋은 발라드곡 모음,https://www.youtube.com//watch?v=Bg8i47sl9ig,
Rainbow Songs,"Big Balloons of Fanta & Pepsi, Giant Coca Cola, Schweppes, Sprite, Mirinda vs Hot and Cold Room #2k",https://www.youtube.com//watch?v=36DSkBiscbo,실시간
BeamNG Hero TV,Monster Trucks Potholes Flatbed Trailer Truck Cars Rescue - Car vs Deep Water - BeamNG.Drive,https://www.youtube.com//watch?v=QQxZ3vfilew,
Intrument Worship,BEAUTIFUL CHRISTIAN WORSHIP MUSIC WITH LYRICS 2022 EVER - BEST CHRISTIAN GOSPEL SONGS COLLECTION,https://www.youtube.com//watch?v=QB-wM5KflQQ,실시간
SBS 뉴스,잉글랜드·프랑스 8강 진출 / 메시·호날두 없을 곳에 왕이 될 선수는? 사카·벨링엄·음바페 맹활약 / 대한민국 결전의 날 [간밤카타르][월드컵은 유튜브서도 SBS],https://www.youtube.com//watch?v=V6aH6osWWqM,
Samirumba,ASMR MUKBANG | 직접 만든 갤럭시 꿀젤리 블루 디저트 아이스크림 먹방 & 레시피 DESSERT Galaxy Honey Jelly CANDY asmr #1,https://www.youtube.com//watch?v=9B2XuN3TPYU,
Yellow Brick Cinema - Relaxing Music,"🔴 Relaxing Music 24/7, Sleep Music, Stress Relief Music, Spa, Meditation, Yoga, Zen, Ocean Sounds",https://www.youtube.com//watch?v=DwhSIBMvsgE,
What The Hales,There's a SPY Among Us - Abandoned Storage Unit Update,https://www.youtube.com//watch?v=fk0jsYcvip8,
OTV,LIVE l Padampur ByPoll Voting: ଭୋଟ୍ ଦେଉଛି ପଦ୍ମପୁର l OTV,https://www.youtube.com//watch?v=Rd32kTqduQM,
Express News,🔴LIVE - Woh Kya Hai with Sajjad Saleem - Express News,https://www.youtube.com//watch?v=tYZxQaCyGYA,
Samirumba,ASMR MUKBANG | 직접 만든 갤럭시 꿀젤리 블루 디저트 아이스크림 먹방 & 레시피 DESSERT Galaxy Honey Jelly CANDY asmr #85,https://www.youtube.com//watch?v=96GW8KMRB0M,
BreakBeat,NONSTOP BREAKBEAT DJ - LIVE MUSIC B12,https://www.youtube.com//watch?v=MQzOe6Ya4eU,
Game Red ball,"Siren Head Granny,Scary Teacher,StickWar Legacy,Among Us,Tom Friend,Join & Clash,Roblox,Get The Girl",https://www.youtube.com//watch?v=znJnQMTdVEo,
K-POP 발라드 모음,겨울 에 듣고 싶은 발라드 100곡 ⛄⛄ 겨울 당신의 마음을 따뜻하게 해줄 한국 발라드 100곡🎄다가오는 크리스마스를 기다리며?,https://www.youtube.com//watch?v=7PmYgT5azD8,
Samirumba,ASMR MUKBANG | 직접 만든 갤럭시 꿀젤리 블루 디저트 아이스크림 먹방 & 레시피 DESSERT Galaxy Honey Jelly CANDY asmr #286,https://www.youtube.com//watch?v=gso7ejTxwAA,
Cafe Music BGM,"Christmas Morning Jazz: Sweet Piano Jazz Music & Cozy Bossa nova Jazz in Winter for relax,work,study",https://www.youtube.com//watch?v=R1ChXf2D9fw,실시간
Geeks + Gamers,Sunday Night Mario Kart Wars | Geeks + Gamers,https://www.youtube.com//watch?v=yvQ0q7-VXaY,
News18 UP Uttarakhand,LIVE : UP By Election | Voting | Mainpuri By Election | Rampur By Election | Khatauli By Election,https://www.youtube.com//watch?v=OepD2mE0KkI,
K-POP 발라드 모음,1990년대 ~ 2000년대 감성 발라드 모음💖하루 종일 듣기 좋은 베스트 100곡💖 겨울 에 듣고 싶은 발라드 명곡,https://www.youtube.com//watch?v=6ZzPRkDI-mY,
Peppa Pig - Official Channel,🔴 Brand New Peppa Pig Sing-Along: LIVE 🐷,https://www.youtube.com//watch?v=65ATrPqfCnI,
My Little Pony Official,🔴 My Little Pony 💛 LIVE 💛My Little Pony Equestria Girls Episodes,https://www.youtube.com//watch?v=y0DU5PvEufk,
The Hawk's Nest,Seattle Seahawks at Los Angeles Rams | Live Reaction,https://www.youtube.com//watch?v=ze9o_4Edbnc,실시간
Best Relax Music,Most Old Beautiful Love Songs Of 70s 80s 90s - Best Romantic Love Songs 💖💖💖,https://www.youtube.com//watch?v=3dd1rgH6ziM,실시간
나산,[ 모든운기가 변하고 대운이 열린다 ] 단기간 금전재복이 크게 연결되는 파동차크라ㅣ금전재복상승 차크라에너지ㅣChakra Meditation,https://www.youtube.com//watch?v=2kVmcrZgTzI,실시간
CNN-News18,Apple Gives Big Blow To China | Apple Plans To Shift Production Out Of China | China News Live,https://www.youtube.com//watch?v=wsOuXRZ1Blg,
