name,title,url_link,online
MBC every1,"🔴LIVE l 어-하🖐 연말에도 함께 하는 #어서와한국은처음이지 정주행 스트리밍☃️ l 스페인, 벨기에, 빌푸네밥상, 팀로우, 아르헨티나 등 l #MBCevery1",https://www.youtube.com//watch?v=pMgi3UOE2I0,
맛있는 녀석들 (Tasty Guys),하늘은 높고 살은 내가 찌는 ★천고마뚱★ 사골 스트리밍 랜덤 라이브,https://www.youtube.com//watch?v=AvrP5xodcLU,
MBN News,"[MBN LIVE/아침&매일경제] 서훈 구속에…또 입연 文 ""귀중한 자산 꺾여"" 與 ""도 넘는 저항"" - 2022.12.05 (월)",https://www.youtube.com//watch?v=a4b4IVl2_jE,실시간
PTC PUNJABI,"Official Live Telecast from Sachkhand Sri Harmandir Sahib Ji, Amritsar | PTC Punjabi | 05.12.2022",https://www.youtube.com//watch?v=PJe5l_j6P7w,
가로세로연구소,매일 오전 7시 30분 김소연의 모닝커피!!!,https://www.youtube.com//watch?v=4cix1_s2K6o,
서울의소리 Voice of Seoul,"[유용화의 뉴스 코멘터리] 12/5(월) '끝까지 추적, 범죄행위 말살?' 尹, 민주노총 파업에 악당 프레임",https://www.youtube.com//watch?v=Qz1wkvGXRRg,실시간
815머니톡,"[LIVE] 11월 3.9조 매도한 개인투자자, 증권사 순이익 -43%급감, 증권사 구조조정 칼바람 (장시작전, 12월5일) 장시영,김민수,민재기,이상엽",https://www.youtube.com//watch?v=uV_ma1jwteo,실시간
 해보라,🔴[LIVE 12월5일] 비둘기로 변신한 파월의 속내ㅣ KBS 해 볼만한 아침 M&W,https://www.youtube.com//watch?v=KKe_Encus6w,실시간
윤희숙TV,"[월요모닝LIVE] 합법파업보장법 만들자는 이재명, 저 무식을 어찌할꼬? (2022.12.05)",https://www.youtube.com//watch?v=jZI5S4JwXBA,실시간
K-POP 발라드 모음,1990년대 ~ 2000년대 감성 발라드 모음💖하루 종일 듣기 좋은 베스트 100곡💖 겨울 에 듣고 싶은 발라드 명곡,https://www.youtube.com//watch?v=6ZzPRkDI-mY,
Animal Doodles,Stop motion ASMR - Catfish hunting Colorful carp koi fish - 다채로운 잉어물고기 | 거대한 개구리 - 무지개 메기/ 스톱 모션,https://www.youtube.com//watch?v=UO2kBs9XM_o,실시간
USGS,"Mauna Loa Eruption, HI - USGS live stream",https://www.youtube.com//watch?v=SnjGqn1K9ZQ,
Pea Pea World,Pea Pea와 자이언트 프링글스 감자 칩 챌린지 - 재미있는 스톱 모션 만화,https://www.youtube.com//watch?v=jLmJ4716PwM,실시간
Pico Pocky,ASMR MUKBANG | 직접 만든 갤럭시 꿀젤리 블루 디저트 아이스크림 먹방 & 레시피 DESSERT Galaxy Honey Jelly Color CANDY mukbang,https://www.youtube.com//watch?v=-Id0Y9HIBkA,
MBCNEWS,"""브라질 잡자"" 선수들 자신감 충전..역대전적 열세에 ""축구는 모른다"" [카타르NOW] (mbc뉴스 2022년 12월4일)",https://www.youtube.com//watch?v=5zDYOLJ4MkY,실시간
MBCNEWS,"피파랭킹 1위, 선수 몸값만 1.5조..국대 16강전 상대 브라질 전력은? [카타르NOW] (MBC뉴스 2022년 12월 4일)",https://www.youtube.com//watch?v=SGCNj_eyHQM,실시간
TIMES NOW,"Russia-Ukraine War Live: Putin's Suicide Drone Scare Ukraine,  Destroy Artillery",https://www.youtube.com//watch?v=Q-zvRkLYX-A,
Rock Music,"Top 100 Best Classic Rock Songs Of All Time Vol 107 🔥 Guns N Roses,Metallica,Queen,U2,CCR,Bon Jovi",https://www.youtube.com//watch?v=R3RX7QybW2M,실시간
Oh Santa,"Pop Christmas Songs Playlist 2023🎅🏼Merry Christmas 2023🎄Mariah Carey, Ariana Grande, Kelly Clarkson🎄",https://www.youtube.com//watch?v=3kr46S2LrHs,실시간
999 Animation,"EEK! Help Rainbow Friends: Sad Story of Blue, Pink, Green, Purple, Red, Orange (Cartoon Animation)",https://www.youtube.com//watch?v=ZpbnGSuvWF4,실시간
The Critical Drinker,Drinker's VIP Lounge - Matthew Marsden,https://www.youtube.com//watch?v=IkKAmkwBuN0,
Cafe Music BGM channel,Smooth Jazz Weekend Music - Relaxing Smooth Instrumental Jazz Playlist,https://www.youtube.com//watch?v=oy4LwkER380,
Tom Grossi,Chiefs vs Bengals Live Play by Play & Reaction,https://www.youtube.com//watch?v=k7kt4b1YR48,
DUBYBUBA,Red VS Blue Food Dessert Mukbang 빨간색 파란색 디저트 먹방 DONA 도나,https://www.youtube.com//watch?v=-RENc-OBv1Y,실시간
CNN-News18,Israeli Aircraft Hits Gaza After Rocket Fire | Israel Attacks Gaza | Israel News | English News Live,https://www.youtube.com//watch?v=oIvjt1HiNeU,
TIMES NOW,"‘Animal Rebellion’ Live: Activists Storm Salt Bae's London Restaurant, Dragged Out After Protest",https://www.youtube.com//watch?v=7-2y65c_efQ,
Music Brokers,Lounge Covers Popular Songs,https://www.youtube.com//watch?v=smePnG4wmOE,
123 GO!,SMART PARENTING HACKS & GADGETS || Survival Guide for Active Kids & Clever Parents! DIYs by 123 GO!,https://www.youtube.com//watch?v=Q3C6GtKpuUY,
Relaxing Piano Music,"당신을 잠들게 하는 영혼의 사운드트랙 🎶 불면증을 위한 음악, 치유를 위한 음악, 명상을 위한 음악",https://www.youtube.com//watch?v=Cq5zT8BhOrI,실시간
India Today,MCD Election Voting Live Update: Delhi's First Civic Polls After Merge Live,https://www.youtube.com//watch?v=N2DvVJ-z8_Q,
Coffee Relaxing Jazz,Instrumental Christmas Jazz Music with Cracking Fireplace 🎄 4K Cozy Christmas Ambience for Relax,https://www.youtube.com//watch?v=9exFDyst_EE,실시간
Samirumba,ASMR MUKBANG | 직접 만든 갤럭시 꿀젤리 블루 디저트 아이스크림 먹방 & 레시피 DESSERT Galaxy Honey Jelly CANDY asmr #285,https://www.youtube.com//watch?v=WGK4QXV7xeA,
Cafe Music BGM channel,MONDAY MORNING JAZZ: December Jazz & Winter Bossa Nova Playlist for the New Week,https://www.youtube.com//watch?v=pyt-UFlejzo,
ABS-CBN News,Rundown (7AM) | ANC (5 December 2022),https://www.youtube.com//watch?v=cITUcFDAJOI,
K-POP 발라드 모음,일할 때 듣기 좋은 노래 💖 1990년대 ~ 2000년대 감성 발라드 모음💖 하루 종일 듣기 좋은 베스트 40곡 - 비오는날 듣기 좋은 발라드곡 모음,https://www.youtube.com//watch?v=Bg8i47sl9ig,
Raiders Report by Chat Sports,"Raiders vs. Chargers Live Streaming Scoreboard, Free Play-By-Play, Highlights, Boxscore, NFL Week 13",https://www.youtube.com//watch?v=WZAmNtYEcfE,
CNN-News18,Apple Gives Big Blow To China | Apple Plans To Shift Production Out Of China | China News Live,https://www.youtube.com//watch?v=ENlqy1R3Vd0,
Rainbow Clay,"Big Balloons of Fanta & Pepsi, Giant Coca Cola, Schweppes, Sprite, Mirinda vs Hot and Cold VS Car",https://www.youtube.com//watch?v=YIivj3H85eU,실시간
MarleyThirteen,Warzone 2 Fun Sweaty Games & Proximity Chat,https://www.youtube.com//watch?v=uAGRUniGQyM,
Samirumba,ASMR MUKBANG | 직접 만든 갤럭시 꿀젤리 블루 디저트 아이스크림 먹방 & 레시피 DESSERT Galaxy Honey Jelly CANDY asmr #1,https://www.youtube.com//watch?v=9B2XuN3TPYU,
News18 India,Russia Ukraine War Update : महायुद्ध में Zelenskyy की लगी लॉट्री  | Latest Hindi News | live,https://www.youtube.com//watch?v=lbWYwsPOiK0,
CNN-News18,Russian President Vladimir Putin Is Open To Talks And Diplomacy On Ukraine | Russia Vs Ukraine War,https://www.youtube.com//watch?v=Jd2kjgojIZ8,
PMB Music,Lounge Bar & Café - Cool Music,https://www.youtube.com//watch?v=IJ1J-W7RpuY,
NITRO,PRZEGLĄD YOUTUBE A POTEM.... GIERKI ZE WSPIERAJĄCYMI .... DADDY IS BACK IN THE TOWN,https://www.youtube.com//watch?v=VZq9q-3GFXo,실시간
Samirumba,ASMR MUKBANG | 직접 만든 갤럭시 꿀젤리 블루 디저트 아이스크림 먹방 & 레시피 DESSERT Galaxy Honey Jelly CANDY asmr #85,https://www.youtube.com//watch?v=96GW8KMRB0M,
K-POP 발라드 모음,겨울 에 듣고 싶은 발라드 50곡 🎄⛄ 겨울 당신의 마음을 따뜻하게 해줄 한국 발라드 50곡⛄다가오는 크리스마스를 기다리며?,https://www.youtube.com//watch?v=xa3lStdXOjo,
CNN-News18,Antony Blinken's Stern Message For Russian President Vladimir Putin | Russia Vs Ukraine War | News18,https://www.youtube.com//watch?v=ps0jPXE_1YI,
ROBOT CHALLENGE,뜨겁고 차가운 방이 있는 Pea Pea - 재미있는 스톱 모션 만화,https://www.youtube.com//watch?v=j70TbckkRnY,실시간
49ers Report by Chat Sports,"49ers vs Dolphins LIVE Streaming Scoreboard, Free Play-By-Play, Highlights & Stats, NFL Week 13",https://www.youtube.com//watch?v=rJelvY13vPY,실시간
Game Red ball,"Join & Clash,Wacky Run,Going Balls,Squid 456 But It' Impostor,Pop Us,Squid Game 456,Poppy Run 3D",https://www.youtube.com//watch?v=RKRlDdBPExA,
K-POP 발라드 모음,겨울 에 듣고 싶은 발라드 100곡 ⛄⛄ 겨울 당신의 마음을 따뜻하게 해줄 한국 발라드 100곡🎄다가오는 크리스마스를 기다리며?,https://www.youtube.com//watch?v=7PmYgT5azD8,
Classic Soul 70s,"70's 80's Soul Groove Mix - Old School - Barry White, James Brown, Billy Paul, Marvin Gaye",https://www.youtube.com//watch?v=Nbc6k_iLyUo,실시간
Intrument Worship,BEAUTIFUL CHRISTIAN WORSHIP MUSIC WITH LYRICS 2022 EVER - BEST CHRISTIAN GOSPEL SONGS COLLECTION,https://www.youtube.com//watch?v=QB-wM5KflQQ,실시간
AbdallahSmash,LAST CHANCE FOR CHARIZARD! Hosting ⭐⭐⭐⭐⭐⭐⭐ Raids!,https://www.youtube.com//watch?v=sVD1Ga4p2Xs,실시간
Peppa Pig - Official Channel,🔴 Giant Peppa Pig and George Pig! LIVE FULL EPISODES 24 Hour Livestream!,https://www.youtube.com//watch?v=kWy4PMihYok,
Kidology,Call-in livestream (ep.2) | Responding to Criticism from @BASSFZz (He can call in!),https://www.youtube.com//watch?v=eA3uJQzE2VQ,
Cozy Apartment,"Cozy Apartment in New York - Late Night Mood Jazz For Relax, Study, Work - Calm Evening Jazz.",https://www.youtube.com//watch?v=ZnSp8-hDh3o,실시간
SpaceX Live,Elon Musk: URGENT Message To NASA For Artemis-1 Mission!,https://www.youtube.com//watch?v=8t9AaKLpvMc,실시간
Las Vegas Raiders Rundown w/ WiFiWillie,🔴 Las Vegas Raiders vs Los Angeles Chargers LIVE PLAY BY PLAY & Reaction,https://www.youtube.com//watch?v=l-G5IlKPbTA,실시간
나산,[ 모든운기가 변하고 대운이 열린다 ] 단기간 금전재복이 크게 연결되는 파동차크라ㅣ금전재복상승 차크라에너지ㅣChakra Meditation,https://www.youtube.com//watch?v=2kVmcrZgTzI,실시간
